{
  "schema_version": "1.0",
  "verdict": "CHANGES_REQUIRED",
  "reviewed_base": "WILL_BE_SET",
  "reviewed_head": "WILL_BE_SET",
  "reviewed_diff_hash": "WILL_BE_SET",
  "summary": "Needs a correctness fix before approval.",
  "findings": [
    {
      "id": "F-MAJOR-1",
      "severity": "MAJOR",
      "category": "CORRECTNESS",
      "file": "fake_module.py",
      "line_start": 2,
      "line_end": 3,
      "problem": "Logic may mishandle negatives.",
      "evidence": "return x * 2 without guard.",
      "required_fix": "Add an explicit unit test for negatives."
    }
  ],
  "required_tests": [
    "pytest tests/agent_loop/test_validate_review_result.py -q"
  ],
  "review_notes": [
    "Address MAJOR finding."
  ]
}
